Date,School,City,State,Killed (includes shooter),Wounded,Total Injured/Killed Victims,Category,School Type,Location,Firearm Type,Number of Shooters,Shooter Age,Shooter Gender,Race
1/28/92,Francis W. Gregory Junior High School,Gentilly,LA,0,1,1,Robbery,Junior High,Outside on School Property,Handgun,1,,Male,
1/31/92,Francis W. Gregory Junior High School,Gentilly,LA,0,1,1,Escalation of Dispute,Junior High,Inside School Building,Handgun,1,,Male,
2/6/92,Douglass High School,Oklahoma City,OK,1,0,1,Escalation of Dispute,High,Inside School Building,,1,14,Male,
2/7/92,Booker T. Washington High School,Norfolk,VA,1,1,2,Escalation of Dispute,High,Outside on School Property,Handgun,1,,Male,
2/26/92,Thomas Jefferson High School,Brooklyn,NY,2,0,2,Escalation of Dispute,High,Inside School Building,Handgun,1,15,Male,Black
3/5/92,Hamilton Middle School,Obetz,OH,0,1,1,Escalation of Dispute,Middle,Inside School Building,Handgun,1,12,Male,White
3/31/92,O. Perry Walker High School,Algiers,LA,1,0,1,Escalation of Dispute,High,Inside School Building,Handgun,1,15,Male,
4/9/92,Fort Myers High School,Fort Myers,FL,0,1,1,Escalation of Dispute,High,Outside on School Property,Handgun,1,16,Male,Black
4/17/92,Lincoln High School,Dallas,TX,1,0,1,Accidental,High,Outside on School Property,,,,,
5/1/92,Lindhurst High School,Olivehurst,CA,4,10,14,Hostage Standoff,High,Inside School Building,Combination of Different Types of Weapons,1,20,Male,White
5/14/92,Huntsville Junior High School,Huntsville,TX,0,1,1,Escalation of Dispute,Junior High,Outside on School Property,Handgun,1,14,Male,White
5/14/92,Silverado Middle School,Napa,CA,0,2,2,Bullying,Junior High,Inside School Building,Handgun,1,14,Male,
5/29/92,Venice High School,Los Angeles,CA,0,3,3,Gang-related,High,Outside on School Property,,,,,
6/6/92,Merced High School,Merced,CA,0,1,1,Escalation of Dispute,High,Inside School Building,Handgun,1,17,Male,Asian
9/11/92,Palo Duro High School,Amarillo,TX,0,7,7,Escalation of Dispute,High,Inside School Building,Handgun,1,17,Male,
9/28/92,Hiram Johnson High School,Sacramento,CA,0,2,2,Racial,High,Outside on School Property,Handgun,1,,Male,Asian
9/30/92,Hollibrook Elementary School,Houston,TX,1,1,2,Gang-related,Elementary,Outside on School Property,Shotgun,1,15,Male,White
10/13/92,Desert View High School,Tucson,AZ,1,0,1,Gang-related,High,Outside on School Property,Handgun,1,20,Male,White
10/19/92,Evander Childs High School,Bronx,NY,0,3,3,Gang-related,High,Outside on School Property,Shotgun,1,,Male,Black
11/4/92,Finney High School,Detroit,MI,0,7,7,Gang-related,High,Inside School Building,Combination of Different Types of Weapons,3,,Male,Black
11/4/92,Marcus Garvey Academy,Detroit,MI,0,1,1,Gang-related,K-8,Outside on School Property,,1,,,
11/4/92,Mumford High School,Detroit,MI,0,3,3,Gang-related,High,Outside on School Property,Handgun,3,14,Male,
11/10/92,Sherman Elementary School,Chicago,IL,1,0,1,Accidental,Elementary,Inside School Building,Handgun,1,13,Male,
11/13/92,Langham Creek High School,Cypress,TX,2,0,2,Murder/Suicide,High,Outside on School Property,Handgun,1,39,Male,
11/16/92,Fairfield High School,Birmingham,AL,1,0,1,Robbery,High,Inside School Building,Handgun,1,,Male,
11/20/92,Tilden High School,Chicago,IL,1,2,3,Escalation of Dispute,High,Inside School Building,Handgun,1,15,Male,
11/24/92,Robert E. Lee High School,Montgomery,AL,0,1,1,Escalation of Dispute,High,Inside School Building,Handgun,1,18,,
11/30/92,Orr High School,Chicago,IL,0,1,1,Escalation of Dispute,High,Outside on School Property,Handgun,1,17,Male,
12/3/92,Woodson High School,Chicago,IL,1,1,2,Gang-related,High,Inside School Building,Handgun,2,23,Male,
12/14/92,Walton High School,Walton,NY,0,1,1,Anger Over Grade/Suspension/Discipline,High,Inside School Building,Handgun,1,15,Male,
1/5/93,Brentwood High School,Brentwood,NY,0,1,1,Escalation of Dispute,High,Inside School Building,,2,,Male,
1/12/93,Norland Senior High School,Miami,FL,1,0,1,Escalation of Dispute,High,Inside School Building,Handgun,,,Male,
1/18/93,East Carter High School,Grayson,KY,2,0,2,Hostage Standoff,High,Inside School Building,Handgun,1,17,Male,White
1/21/93,Fairfax High School,Los Angeles,CA,1,1,2,Accidental,High,Inside School Building,Handgun,1,,Male,
2/1/93,Redmond Junior High School,Redmond,WA,1,0,1,Suicide/Attempted,High,Outside on School Property,,1,14,Male,
2/1/93,Amityville High School,Amityville,NY,1,1,2,Escalation of Dispute,High,Outside on School Property,Handgun,1,17,Male,
2/4/93,Clayton High School,Atlanta,GA,1,0,1,Escalation of Dispute,High,Outside on School Property,Handgun,1,17,Male,
2/8/93,Washington-Dix Street Academy (High School),Washington,DC,1,0,1,Robbery,High,Inside School Building,Handgun,,,Male,
2/8/93,Middle River Middle School,Middle River,MN,1,0,1,Suicide/Attempted,Middle,Inside School Building,Rifle,1,14,Male,
2/22/93,Reseda High School,Los Angeles,CA,1,0,1,Gang-related,High,Inside School Building,Handgun,1,15,Male,Black
2/26/93,Gloucester High School,Gloucester,MA,1,0,1,Suicide/Attempted,High,Inside School Building,,1,15,Male,
3/8/93,Dozier Middle School,Denbigh,VA,1,0,1,Mental Health,Middle,Outside on School Property,Handgun,1,32,Male,Black
3/18/93,Harlem High School,Harlem,GA,1,1,2,Bullying,High,Inside School Building,Handgun,1,15,Male,
3/25/93,Sumner High School,St. Louis,MO,1,0,1,Domestic w/ Targeted Victim,High,Inside School Building,Handgun,1,17,Female,
4/3/93,Grant High School,Sacramento,CA,1,1,2,,High,Outside on School Property,Shotgun,1,,Male,
4/15/93,Ford Middle School,Acushnet,MA,1,0,1,Mental Health,Middle,Inside School Building,Shotgun,1,42,Male,White
4/16/93,Grant High School,Sacramento,CA,1,0,1,Accidental,High,Outside on School Property,Handgun,,,,
4/16/93,Mount Tahoma High School,Tacoma,WA,1,0,1,Suicide/Attempted,High,Outside on School Property,Handgun,1,33,Female,
5/14/93,Nimitz High School,Irving,TX,1,0,1,Escalation of Dispute,High,Inside School Building,Handgun,1,17,Male,Some Other
5/24/93,Upper Perkiomen High School,Pennsburg,PA,1,0,1,Bullying,High,Inside School Building,Handgun,1,15,Male,White
5/27/93,Francis T. Nicholls High School,New Orleans,LA,1,0,1,Escalation of Dispute,High,Inside School Building,Handgun,1,17,Male,Black
7/7/93,Dorsey High School,Los Angeles,CA,1,0,1,Gang-related,High,Outside on School Property,Handgun,,,Male,
8/3/93,Theodore Roosevelt High School,New York,NY,0,1,1,,High,Inside School Building,Handgun,1,,Male,
8/31/93,Harper High School,Atlanta,GA,1,0,1,Escalation of Dispute,High,Inside School Building,Handgun,1,15,Male,Black
9/1/93,Junction City High School,Junction City,KS,0,1,1,Escalation of Dispute,High,Inside School Building,Handgun,1,15,Male,
9/2/93,Roosevelt High School,Dallas,TX,1,0,1,Escalation of Dispute,High,Inside School Building,Handgun,1,16,Male,
9/16/93,Roosevelt High School,Chicago,IL,1,0,1,Gang-related,High,Outside on School Property,,,,Male,
9/17/93,Central Junior High School,Sheridan,WY,1,4,5,Indiscriminate Shooting,Junior High,Outside on School Property,,1,29,Male,White
9/17/93,Downers South High School,Downers Grove,IL,1,0,1,Escalation of Dispute,High,Outside on School Property,Handgun,1,16,Male,White
9/25/93,Weatherless Elementary School,Washington,DC,2,0,2,Gang-related,Elementary,Outside on School Property,Handgun,2,,Male,
10/12/93,Dover High School,New Castle,DE,1,0,1,Murder/Suicide,High,Inside School Building,Handgun,1,16,Female,
10/18/93,J. H. Johnson Junior High School,Washington,DC,0,1,1,,Junior High,Inside School Building,Handgun,1,15,Male,
11/1/93,Sullivan High School,Chicago,IL,1,0,1,Intentional Property Damage,High,Inside School Building,Handgun,1,16,Male,
11/4/93,New Britain High School,New Britain,CT,1,0,1,Gang-related,High,Outside on School Property,,1,20,Male,Some Other
11/4/93,Terry Parker High School,Jacksonville,FL,1,0,1,Robbery,High,Outside on School Property,Handgun,1,19,Male,
11/4/93,Bay Springs High School,Bay Springs,MS,1,0,1,,High,Inside School Building,,,,,
11/11/93,Ridgely Elementary School,Springfield,IL,1,0,1,Gang-related,High,Inside School Building,Handgun,,,,
12/1/93,Wauwatosa West High School,Wauwatosa,WI,1,0,1,Anger Over Grade/Suspension/Discipline,High,Inside School Building,,1,21,Male,White
12/2/93,New Britain High School,New Britain,CT,1,0,1,Gang-related,High,Outside on School Property,,1,,Male,
12/8/93,Beach High School,Savannah,GA,1,0,1,Gang-related,High,Outside on School Property,Handgun,1,16,Male,
12/15/93,Chatsworth High School,San Fernando Valley,CA,1,0,1,Robbery,High,Outside on School Property,Handgun,1,14,Male,
12/17/93,Chelsea High School,Chelsea,MI,1,2,3,Anger Over Grade/Suspension/Discipline,High,Inside School Building,Handgun,1,,Male,
1/20/94,Los Altos High School,Hacienda Heights,CA,1,0,1,Escalation of Dispute,High,Outside on School Property,,1,,Male,
1/21/94,Kennard High School,Kennard,TX,1,0,1,Suicide/Attempted,High,Inside School Building,Rifle,1,17,Male,
1/24/94,Eau Claire High School,Columbia,SC,1,0,1,Bullying,High,Inside School Building,Handgun,1,18,Male,Black
1/26/94,Paul Lawrence Dunbar High School,Washington,DC,0,0,0,Intentional Property Damage,High,Inside School Building,Handgun,1,,Male,
1/26/94,Eliot Junior High School,Washington,DC,0,0,0,,Junior High,,,1,,,
1/27/94,Washington Elementary School,San Jose,CA,1,0,1,Gang-related,Elementary,Outside on School Property,Unknown,1,,Male,N/A
1/31/94,Whitman Middle School,Seattle,WA,1,0,1,,Middle,Outside on School Property,Rifle,1,24,Male,White
2/8/94,Osborn High School,Detroit,MI,1,0,1,,High,Outside on School Property,,,,,
2/18/94,Spartanburg High School,Spartanburg,SC,0,1,1,Escalation of Dispute,High,Outside on School Property,Handgun,1,,Male,
3/1/94,Kemper Military School and College,Boonville,MO,2,0,2,Domestic w/ Targeted Victim,Other,Inside School Building,Shotgun,1,33,Male,Black
3/3/94,Ensley High School,Birmingham,AL,0,1,1,Gang-related,High,Inside School Building,Handgun,1,17,Male,
3/9/94,Eastern High School,Washington,DC,1,0,1,Escalation of Dispute,High,Inside School Building,Handgun,1,17,Male,
3/15/94,Goose Creek High School,Charleston,SC,1,0,1,Escalation of Dispute,High,Outside on School Property,,,,Male,
3/23/94,Ballard High School,Seattle,WA,1,1,2,Gang-related,High,Outside on School Property,,1,16,Male,Some Other
3/25/94,Etowah High School,Cherokee County,GA,1,0,1,Suicide/Attempted,High,Inside School Building,Handgun,1,15,Male,
4/5/94,McNeil High School,Austin,TX,0,2,2,Accidental,High,Inside School Building,Handgun,1,16,Male,
4/8/94,Largo High School,Upper Marlboro,MD,0,1,1,Indiscriminate Shooting,High,Inside School Building,Handgun,1,17,Male,
4/12/94,Margaret Leary Elementary School,Butte,MT,1,0,1,Bullying,Elementary,Outside on School Property,Handgun,1,10,Male,White
4/13/94,49th Street Elementary School,Los Angeles,CA,1,0,1,Suicide/Attempted,Elementary,Inside School Building,Handgun,1,10,Male,White
4/19/94,Eliot Junior High School,Washington,DC,1,0,1,,High,Outside on School Property,,,,,
4/20/94,Dickinson Middle School,South Bend,IN,0,1,1,Accidental,Middle,Inside School Building,Handgun,1,13,Male,
4/21/94,J.T. Moore Middle School,Nashville,TN,1,0,1,Accidental,Middle,Inside School Building,,1,13,Male,
5/2/94,North Miami High School,North Miami,FL,1,0,1,Accidental,High,Outside on School Property,Handgun,1,18,Male,
5/25/94,LaSalle High School,South Bend,IN,0,1,1,Escalation of Dispute,High,Outside on School Property,Handgun,1,16,Male,
5/25/94,Lakeland Regional High School,Wanaque,NJ,1,0,1,Suicide/Attempted,High,Outside on School Property,Handgun,1,17,Female,
5/26/94,Larry A. Ryle High School,Union,KY,0,0,0,Hostage Standoff,High,Inside School Building,Handgun,1,17,Male,White
7/24/94,Manchester Elementary School,Manchester,PA,1,0,1,Escalation of Dispute,Elementary,Outside on School Property,,1,15,Male,
7/25/94,Ottumwa High School,Ottumwa,IA,1,0,1,Escalation of Dispute,High,Inside School Building,Handgun,1,16,Male,
9/7/94,Hollywood High School,Los Angeles,CA,1,0,1,Gang-related,High,Outside on School Property,,,,Male,
9/8/94,Sweet Home High School,Albany,NY,0,1,1,Bullying,High,Inside School Building,Handgun,1,14,Male,
9/19/94,Locke High School,Los Angeles,CA,0,3,3,Gang-related,High,Outside on School Property,,,,Male,
9/22/94,Lebanon Union High School,Lebanon,OR,0,1,1,Accidental,High,Outside on School Property,Handgun,1,15,Male,
10/12/94,Grimsley High School,Greensboro,NC,1,1,2,Anger Over Grade/Suspension/Discipline,High,Outside on School Property,,1,16,Male,White
10/17/94,Hubbard High School,Chicago,IL,0,1,1,Gang-related,High,Outside on School Property,Handgun,1,,Male,
10/31/94,Aliso Niguel High school,Aliso Veijo,CA,0,1,1,Suicide/Attempted,High,Inside School Building,Handgun,1,16,Male,
11/5/94,Thomas Jefferson Elementary School,San Leandro,CA,1,0,1,,Elementary,Outside on School Property,Handgun,1,,Male,
11/7/94,Wickliffe Middle School,Wickliffe,OH,1,4,5,Mental Health,Middle,Inside School Building,,1,37,Male,White
11/8/94,West Delaware High School,Manchester,IA,0,1,1,Intentional Property Damage,High,,,,,Male,
11/9/84,Wilbur Cross High School,New Haven,CT,0,1,1,Escalation of Dispute,High,Inside School Building,Handgun,1,16,Male,
11/15/94,Stadium High School,Tacoma,WA,1,0,1,Suicide/Attempted,High,Inside School Building,Handgun,1,17,Male,White
1/5/95,Cardozo Senior High School,Washington,DC,1,0,1,Gang-related,High,Inside School Building,Handgun,1,14,Male,Black
1/10/95,Palm Beach Gardens High School,Palm Beach Gardens,FL,1,0,1,Suicide/Attempted,High,Outside on School Property,Handgun,1,15,Male,
1/12/95,Garfield High School,Seattle,WA,0,2,2,Escalation of Dispute,High,Inside School Building,Handgun,1,15,Male,Black
1/23/95,Sacred Heart Middle School,Redlands,CA,2,,2,Anger Over Grade/Suspension/Discipline,Middle,Both Inside/Outside,Shotgun,1,13,Male,White
1/24/95,Spingarn High School,Washington,DC,0,1,1,,High,Inside School Building,Handgun,1,16,Male,
2/2/95,Jordan High School,Long Beach,CA,1,1,2,Gang-related,High,Outside on School Property,Handgun,1,,Male,
2/8/95,Chadron Middle School,Scottsbluff,NE,0,1,1,,Middle,,Handgun,1,,Male,
3/3/95,Pershing High School,Detroit,MI,0,1,1,,High,Inside School Building,Handgun,1,,,
3/27/95,Redford High School,Detroit,MI,0,1,1,Accidental,High,Inside School Building,Handgun,1,18,Male,
6/14/95,Lake Worth High School,Lake Worth,FL,0,2,2,Domestic w/ Targeted Victim,High,Outside on School Property,Handgun,1,19,Male,
8/29/95,Memorial Middle School,Laredo,TX,1,0,1,Domestic w/ Targeted Victim,Middle,Inside School Building,Shotgun,1,12,Male,White
9/12/95,Cypress Junior High School,Memphis,TN,1,0,1,Escalation of Dispute,Junior High,Inside School Building,Handgun,1,15,Male,Black
9/14/95,Olathe North High School,Olathe,KS,2,4,6,Escalation of Dispute,High,Outside on School Property,Handgun,1,17,Male,Black
9/15/95,George Rogers Clark High School,Winchester,KY,0,0,0,Hostage Standoff,High,Inside School Building,Multiple Handguns,1,,Male,
9/27/95,Blount High School,Prichard,AL,0,1,1,Escalation of Dispute,High,Inside School Building,Handgun,1,19,Male,
9/29/95,Tavares Middle School,Tavares,FL,1,0,1,Escalation of Dispute,Middle,Outside on School Property,Handgun,1,14,Male,White
10/12/95,Blackville-Hilda High School,Blackville,SC,2,1,3,Anger Over Grade/Suspension/Discipline,High,Inside School Building,Handgun,1,16,Male,Black
10/23/95,Lake Howell High School,Casselberry,FL,0,1,1,Accidental,High,Outside on School Property,Handgun,1,16,Female,
10/30/95,John F. Kennedy High School,Richmond,VA,0,4,4,Escalation of Dispute,High,Outside on School Property,Handgun,1,17,Male,Black
11/2/95,Blue Lake Elementary School (bus),Miami Beach,FL,1,1,2,Hostage Standoff,Elementary,School Bus,,1,42,Male,Asian
11/15/95,Richland High School,Lynnville,TN,2,1,3,Bullying,High,Inside School Building,Rifle,1,17,Male,White
11/28/95,Thomas A. Edison Vocational and Technical High School,New York,NY,1,0,1,Robbery,High,Outside on School Property,Handgun,1,,Male,
1/2/96,Girard High School,Girard,PA,1,0,1,Suicide/Attempted,High,Inside School Building,,1,16,Male,
1/19/96,Winston Education Center,Washington,DC,1,0,1,Escalation of Dispute,K-8,Inside School Building,,1,18,Male,Black
1/26/96,East High School,Memphis,TN,1,0,1,Escalation of Dispute,High,Outside on School Property,Handgun,,,,
2/2/96,Frontier Middle School,Moses Lake,WA,3,1,4,Hostage Standoff,Middle,Inside School Building,Combination of Different Types of Weapons,1,14,Male,White
2/8/96,Mid-Peninsula High School,Menlo Park,CA,1,1,2,Indiscriminate Shooting,High,Outside on School Property,,1,16,Male,White
2/22/96,Jenkins High School,Savannah,GA,1,0,1,Escalation of Dispute,High,Outside on School Property,Handgun,1,15,Male,Black
2/29/96,Beaumont High School (bus),St. Louis,MO,1,1,2,Domestic w/ Targeted Victim,High,School Bus,Handgun,1,21,Male,Black
3/11/96,North Stanley High School,New Longdon,NC,1,0,1,Suicide/Attempted,High,Inside School Building,Handgun,1,15,Male,White
3/19/96,Swainston Middle School,Las Vegas,NV,0,2,2,,Middle,Outside on School Property,Other,1,,,
4/11/96,Talladega High School,Talladega,AL,1,0,1,Escalation of Dispute,High,Outside on School Property,Shotgun,1,16,Male,
4/15/96,McKinley High School,Washington,DC,1,0,1,,High,Inside School Building,,,,,
5/14/96,Bingham Middle School,Taylorsville,UT,1,1,2,Suicide/Attempted,High,School Bus,Handgun,1,15,Male,White
5/22/96,Colton High School,Colton,CA,1,,1,Gang-related,High,Outside on School Property,Handgun,1,14,Male,
6/4/96,West Valley High School,Hemet,CA,1,0,1,Suicide/Attempted,High,Inside School Building,,1,16,Male,
7/26/96,John Marshall High School,Los Angeles,CA,0,2,2,Escalation of Dispute,High,Inside School Building,Handgun,1,18,Male,Some Other
9/25/96,Dekalb Alternative School,Decatur,GA,1,0,1,Anger Over Grade/Suspension/Discipline,12-Jun,Inside School Building,,1,16,Male,Black
10/2/96,Smedley Elementary School,Philadelphia,PA,2,,2,Domestic w/ Targeted Victim,Elementary,Outside on School Property,,1,,Male,
10/4/96,St. Bernard High School,Playa Del Rey,CA,1,1,2,,High,Outside on School Property,,1,17,Male,
10/9/96,Jacksonville High School bus,Sherwood,AR,1,0,1,Escalation of Dispute,High,Outside on School Property,,1,14,Male,Black
10/14/96,Sumner High School,St. Louis,MO,1,0,1,Escalation of Dispute,High,Inside School Building,,1,14,Male,
11/27/96,Highlands High School,Sacramento,CA,1,0,1,Officer Involved Shooting,High,Outside on School Property,Handgun,,,,
1/8/97,Crown Heights High School,New York,NY,1,3,4,Escalation of Dispute,High,Off School Property,Handgun,1,,Male,
1/27/97,Conniston Middle School,West Palm Beach,FL,1,0,1,Escalation of Dispute,Middle,Outside on School Property,Handgun,1,13,Male,Black
2/6/97,Wingfield High School,Jackson,MS,0,1,1,Escalation of Dispute,High,Off School Property,Handgun,1,16,Male,Black
2/13/97,Morris High School,Bronx,NY,0,1,1,Accidental,High,Inside School Building,Handgun,1,17,Male,
2/13/97,Samuel Gompers High School,Bronx,NY,0,1,1,Escalation of Dispute,High,Outside on School Property,Handgun,1,,Male,
2/19/97,Bethel Regional High School,Bethel,AK,2,2,4,Bullying,High,Inside School Building,Shotgun,1,16,Male,American Indian or Alaska Native
2/20/97,First Coast High School,Jacksonville,FL,1,0,1,Suicide/Attempted,High,Outside on School Property,Handgun,1,17,Female,
2/21/97,Rancho High School,Las Vegas,NV,0,1,1,Gang-related,High,Outside on School Property,Handgun,1,20,Male,Some Other
3/17/97,Pershing High School,Detroit,MI,1,0,1,Escalation of Dispute,High,Outside on School Property,Handgun,1,15,Male,
4/3/97,Maria Del Rey Junior High School,Mar Vista,CA,1,0,1,Gang-related,High,Outside on School Property,,,,,
4/28/97,John Marshall High School,Los Angeles,CA,1,0,1,Gang-related,High,Outside on School Property,Handgun,1,15,Male,
4/30/97,City-as-School High School,New York,NY,1,0,1,,High,Outside on School Property,,,,,
5/13/97,Northwestern High School,Miami,FL,0,1,1,Escalation of Dispute,High,Inside School Building,Handgun,1,17,Male,
5/20/97,Dunbar High School,Dayton,OH,0,1,1,Accidental,High,Inside School Building,Handgun,1,16,Male,
6/24/97,Jefferson Davis High School,Montgomery,AL,1,0,1,Escalation of Dispute,High,Outside on School Property,Handgun,1,16,Male,Black
10/1/97,Pearl High School,Pearl,MS,3,7,10,Domestic w/ Targeted Victim,High,Inside School Building,Rifle,1,16,Male,White
10/5/97,Moore West Junior High School,Oklahoma City,OK,0,1,1,Escalation of Dispute,Junior High,Outside on School Property,Handgun,1,,Male,White
10/10/97,Wallace High School,Gary,IN,1,2,3,Gang-related,High,Outside on School Property,Handgun,1,20,Male,
10/14/97,Lakeview Centennial High School,Garland,TX,1,0,1,Suicide/Attempted,High,,,1,19,Male,
10/15/97,Lincoln Middle School,Palmetto,FL,0,1,1,Escalation of Dispute,Middle,Outside on School Property,Shotgun,1,13,Male,
10/20/97,McClymonds High School,Oakland,CA,1,1,2,,High,Outside on School Property,,,,,
10/22/97,John Glenn High School,Norwalk,CA,2,0,2,Murder/Suicide,High,Outside on School Property,Handgun,1,21,Male,Asian
11/7/97,Ribault High School,Jacksonville,FL,1,1,2,Escalation of Dispute,High,Outside on School Property,Handgun,1,18,Male,
11/13/97,Creekside Elementary School,Sacramento,CA,1,0,1,Domestic w/ Targeted Victim,Elementary,Outside on School Property,Handgun,1,39,Male,
12/1/97,Heath High School,West Paducah,KY,3,5,8,Indiscriminate Shooting,High,Outside on School Property,Combination of Different Types of Weapons,1,14,Male,White
12/15/97,Stamps High School,Stamps,AR,0,2,2,Indiscriminate Shooting,High,Outside on School Property,Rifle,1,14,Male,White
2/12/98,Hoboken High School,Hoboken,NJ,2,0,2,Domestic w/ Targeted Victim,High,Outside on School Property,Handgun,1,61,Male,
2/25/98,Reed City High School,Reed City,MI,1,0,1,Suicide/Attempted,High,Inside School Building,Rifle,1,14,Male,
2/27/98,Marshall High School,Fairfax,VA,1,0,1,Gang-related,High,Outside on School Property,Rifle,1,18,Male,Asian
3/24/98,Westside Middle School,Jonesboro,AR,5,10,15,Indiscriminate Shooting,Middle,Outside on School Property,Combination of Different Types of Weapons,2,,Male,White
3/25/98,Coldwater High School,Coldwater,MI,1,0,1,Suicide/Attempted,High,Outside on School Property,Shotgun,1,18,Male,
3/25/98,Fernando Rivera Middle School,Daly City,CA,0,0,0,Anger Over Grade/Suspension/Discipline,Middle,Outside on School Property,Handgun,1,13,Male,
3/30/98,Grey Culbreth Middle School,Chapel Hill,NC,1,0,1,Suicide/Attempted,Middle,Inside School Building,Handgun,1,13,Female,
3/31/98,Oakfield Middle School,Oakfield,WI,0,0,0,Anger Over Grade/Suspension/Discipline,Middle,Outside on School Property,Rifle,1,14,Male,
4/23/98,Culver City High School,Los Angeles,CA,0,2,2,Gang-related,High,Outside on School Property,,,,,
4/24/98,Parker Middle School,Edinboro,PA,1,3,4,Indiscriminate Shooting,Middle,Off School Property,Handgun,1,14,Male,White
4/28/98,Pardeeville Elementary School,Pardeeville,WI,0,1,1,Robbery,Elementary,Outside on School Property,Handgun,1,15,Male,
4/28/98,Philadelphia Elementary School,Pomona,CA,2,1,3,Gang-related,Elementary,Outside on School Property,Handgun,1,14,Male,
5/1/98,North Miami Senior High School,Miami,FL,0,1,1,Gang-related,High,Outside on School Property,,1,,Male,
5/1/98,Public School 18,Buffalo,NY,1,1,2,Domestic w/ Targeted Victim,Elementary,Inside School Building,Handgun,1,37,Male,
5/19/98,Lincoln County High School,Fayetteville,TN,1,0,1,Escalation of Dispute,High,Outside on School Property,Rifle,1,18,Male,
5/21/98,Thurston High School,Springfield,OR,2,23,25,Anger Over Grade/Suspension/Discipline,High,Inside School Building,Combination of Different Types of Weapons,1,15,Male,White
5/21/98,Onalaska High School,Onalaska,WA,1,0,1,Suicide/Attempted,High,School Bus,Handgun,1,14,Male,
5/21/98,Rialta High School,Rialto,CA,1,0,1,Suicide/Attempted,High,Outside on School Property,Handgun,1,15,Male,White
5/27/98,Washington Middle School,Pasadena,CA,1,1,2,Gang-related,Middle,Outside on School Property,,,,Male,
5/29/98,Stranahan High School,Ft. Lauderdale,FL,2,0,2,Murder/Suicide,High,Outside on School Property,Handgun,1,29,Male,White
6/15/98,Armstrong High School,Richmond,VA,0,2,2,Escalation of Dispute,High,Inside School Building,Handgun,1,15,Male,
9/11/98,Herbert Hoover High School,Glendale,CA,0,1,1,Gang-related,High,Outside on School Property,,1,,Male,
9/30/98,North Miami High School,Miami,FL,0,3,3,Gang-related,High,Inside School Building,,2,,Male,
9/30/98,Leesburg High School,Leesburg,FL,0,1,1,Accidental,High,Outside on School Property,Handgun,1,17,Male,
11/3/98,Martin Luther King High School,Philadelphia,PA,1,0,1,Escalation of Dispute,High,Outside on School Property,,2,,Male,
11/30/98,Hancock Middle High School,Hancock,NY,0,1,1,Suicide/Attempted,12-Jun,Inside School Building,Handgun,1,14,Female,
12/3/98,Ernie Elementary School,Gary,IN,0,1,1,Escalation of Dispute,Elementary,Inside School Building,Handgun,1,36,Female,
12/11/98,Ben Davis Junior High School,Indianapolis,IN,0,1,1,Accidental,Junior High,School Bus,Handgun,1,,Male,
1/8/99,Central High School,Carrollton,GA,2,0,2,Murder/Suicide,High,Inside School Building,Handgun,2,,Multiple,
1/14/99,Harry S. Truman High School,New York,NY,0,2,2,Escalation of Dispute,High,Outside on School Property,Handgun,1,16,Male,
1/21/99,Richland High School,North Richland Hills,TX,1,0,1,Suicide/Attempted,High,Inside School Building,Handgun,1,16,Male,
2/11/99,Ombudsman Educational Service Center,Elgin,IL,1,1,2,Gang-related,High,Inside School Building,Handgun,1,,Male,
2/11/99,Jefferson-Todd Educational Center,Purvis,MS,0,0,0,Racial,Other,Inside School Building,,1,44,Male,
3/4/99,Niles West High School,Skokie,IL,1,1,2,Domestic w/ Targeted Victim,High,Inside School Building,Handgun,1,26,Male,
4/16/99,Notus Jr. Sr. High School,Notus,ID,0,0,0,Mental Health,12-Jun,Inside School Building,Shotgun,1,16,Male,White
