Date,School,City,State,Killed (includes shooter),Wounded,Total Injured/Killed Victims,Category,School Type,Location,Firearm Type,Number of Shooters,Shooter Age,Shooter Gender,Race
1/5/70,Hine Junior High School,Washington,DC,1,0,1,Accidental,High,Inside School Building,Handgun,1,15,Male,
1/5/70,Sousa Junior High,Washington,DC,0,1,1,Accidental,Junior High,Inside School Building,Handgun,1,,Male,
1/5/70,Unnamed High School,Washington,DC,0,0,0,Robbery,High,Outside on School Property,Handgun,1,,Male,
2/6/70,John F. Kennedy High School,Cleveland,OH,0,1,1,Escalation of Dispute,High,Inside School Building,Handgun,1,18,Male,
3/23/70,David Starr Jordan High School,Long Beach,CA,0,2,2,,High,Outside on School Property,Handgun,2,,Male,
4/15/70,Pine Bluff Coleman High School,Pine Bluff,AR,1,5,6,Gang-related,High,Inside School Building,Multiple Handguns,8,,Male,
4/22/70,Pierre S. Dupont High School,Wilmington,DE,1,0,1,Escalation of Dispute,High,Inside School Building,Handgun,1,16,Male,
5/8/70,Carver High School,Delray Beach,FL,0,1,1,Escalation of Dispute,High,Inside School Building,Handgun,1,18,Male,
5/15/70,Ben Lomond High School,Ogden,UT,0,2,2,Suicide/Attempted,High,Inside School Building,Handgun,1,15,Male,White
8/28/70,Riverside High School,El Paso,TX,0,1,1,Escalation of Dispute,High,Outside on School Property,Handgun,2,,Male,
8/31/70,Allapatah Elementary School,Miami,FL,1,0,1,Racial,Elementary,Inside School Building,Rifle,1,27,Male,Black
9/14/70,Hamilton High School,Nashville,TN,1,2,3,Escalation of Dispute,High,Inside School Building,Rifle,1,18,Male,Black
9/24/70,Meridian High School,Meridian ,ID,1,0,1,Accidental,High,Outside on School Property,Handgun,1,,,
9/28/70,Central High School,Davenport,IA,0,1,1,Domestic w/ Targeted Victim,High,Inside School Building,,1,17,Male,
10/5/70,Pontiac Central High School,Detroit,MI,0,4,4,Racial,High,Outside on School Property,Handgun,,,Male,
10/19/70,Booker T. Washington High School,Nashville,TN,1,0,1,Escalation of Dispute,High,Inside School Building,Handgun,1,17,Male,
10/20/70,Washington Junior High School,Nashville,TN,0,1,1,,Junior High,Inside School Building,Handgun,1,13,Male,
10/27/70,Appleseed Junior High School,Mansfield,OH,0,1,1,Escalation of Dispute,Junior High,Inside School Building,Handgun,1,13,Male,
11/20/70,Harlan High School,Chicago,IL,0,2,2,Gang-related,High,Inside School Building,Handgun,1,15,Male,
12/12/70,Xavier High School,Appleton,WI,1,0,1,Officer Involved Shooting,High,Inside School Building,Handgun,,,,
2/2/71,Morris E. Leeds Middle School,Philadelphia,PA,1,0,1,Anger Over Grade/Suspension/Discipline,Middle,Outside on School Property,Handgun,1,14,Male,Black
2/5/71,John F. Kennedy High School,Willingboro,PA,0,1,1,,High,,Handgun,1,14,Male,
2/10/71,Oak Cliff High School,Dallas,TX,0,2,2,Escalation of Dispute,High,Outside on School Property,Shotgun,1,17,Male,
2/25/71,Franklin D. Roosevelt Junior High School,Cleveland,OH,1,0,1,,Junior High,Inside School Building,Rifle,1,,Male,
3/9/71,Roskruge Junior High School,Tucson,AZ,0,1,1,Accidental,Junior High,Outside on School Property,Handgun,1,13,Male,
4/5/71,William Penn High School,Harrisburg,PA,0,1,1,Domestic w/ Targeted Victim,High,Inside School Building,Handgun,1,17,Male,
5/27/71,Benton Harbor High School,Saint Joseph,MI,0,1,1,Bullying,High,Inside School Building,Handgun,1,17,Male,
6/2/71,East Aurora Middle School,East Aurora,NY,1,0,1,Accidental,Middle,Inside School Building,Handgun,1,13,Male,
8/20/71,Monessen High School,Monessen,PA,0,1,1,Racial,High,Outside on School Property,Handgun,1,72,Male,White
9/9/71,Dunbar High School,Lubbock,TX,1,0,1,Escalation of Dispute,High,Inside School Building,Handgun,1,15,Male,White
9/24/71,McKinley Vocational High School,Buffalo,NY,1,0,1,Escalation of Dispute,High,Inside School Building,Handgun,1,,,
9/28/71,Central High School,Minneapolis,MN,0,0,0,Escalation of Dispute,High,Inside School Building,,1,18,Male,
9/29/71,Peabody Junior High School,Petersburg,VA,1,2,3,Indiscriminate Shooting,Junior High,Inside School Building,Handgun,1,14,Male,Black
10/28/71,City College High School,Baltimore,MD,0,1,1,Escalation of Dispute,High,Inside School Building,Handgun,1,,Male,
10/29/71,Frederick Douglass High School,Baltimore,MD,0,2,2,Escalation of Dispute,High,Outside on School Property,Handgun,2,,Male,
10/29/71,Forest Park High School,Baltimore,MD,0,1,1,Escalation of Dispute,High,Outside on School Property,Rifle,1,17,Male,
11/3/71,Carlsbad Mid-High School,Carlsbad,NM,1,1,2,Mental Health,12-Jun,Inside School Building,Rifle,1,22,Male,
11/8/71,Grove Elementary School,Grove,OK,1,0,1,Escalation of Dispute,Elementary,Inside School Building,Handgun,1,63,Male,
11/24/71,Edmondson Senior High School,Baltimore,MD,1,0,1,Escalation of Dispute,High,Outside on School Property,Handgun,1,17,Male,
12/6/71,Louis Stevenson Junior High School,Los Angeles,CA,0,4,4,Gang-related,Junior High,Outside on School Property,Handgun,2,14,Male,Some Other
12/13/71,Carver Vocational High School,Baltimore,MD,0,1,1,Escalation of Dispute,High,Inside School Building,Handgun,1,17,Male,
1/5/72,Parkview Elementary School,Washington,DC,1,0,1,Domestic w/ Targeted Victim,Elementary,Inside School Building,Handgun,1,61,Male,
1/24/72,Stow High School,Stow,OH,0,1,1,Anger Over Grade/Suspension/Discipline,High,Inside School Building,Handgun,1,16,Male,White
1/26/72,Harlem Park Junior High School,Baltimore,MD,0,1,1,Escalation of Dispute,Junior High,Outside on School Property,Rifle,1,17,Male,
1/26/72,Gwynn Falls Junior High School,Baltimore,MD,0,1,1,Accidental,Junior High,Inside School Building,Handgun,1,,Male,
2/14/72,Camlumet High School,Chicago,IL,1,0,1,Gang-related,High,Outside on School Property,Handgun,,,,
2/15/72,Kenwood High School,Chicago,IL,1,0,1,Officer Involved Shooting,High,Inside School Building,Handgun,,,,
2/28/72,Markham Junior High School,Los Angeles,CA,0,1,1,Accidental,Junior High,Inside School Building,Handgun,1,14,Male,
3/13/72,Unnamed Junior High School,Houston,TX,0,1,1,Accidental,Junior High,Inside School Building,Handgun,1,15,Male,
4/12/72,East Ascension Junior High,Gonzales,LA,1,1,2,Domestic w/ Targeted Victim,Junior High,Inside School Building,,1,28,Male,
5/4/72,Libby Booth Elementary School,Reno,NV,1,0,1,Anger Over Grade/Suspension/Discipline,Elementary,Inside School Building,Handgun,1,53,Male,White
5/5/72,Decatur Central High School,Indianapolis,IN,1,0,1,Mental Health,High,Outside on School Property,Handgun,1,16,Female,White
9/14/72,Francis Scott Key Junior High,Houston,TX,0,1,1,Escalation of Dispute,Junior High,Inside School Building,Handgun,1,16,Male,
9/15/72,Saginaw High School,Saginaw,MI,0,2,2,,High,Inside School Building,,1,17,Male,
9/19/72,Cullen Junior High,Houston,TX,0,1,1,Domestic w/ Targeted Victim,Junior High,Inside School Building,Handgun,1,33,Male,
9/21/72,Thorton Junior High,Akron,OH,0,1,1,Robbery,Junior High,Inside School Building,Handgun,1,18,Male,
11/11/72,Jefferson High School,Los Angeles,CA,0,5,5,Gang-related,High,Outside on School Property,,2,,Male,
11/27/72,Pontiac Central High School,Pontiac,MI,0,5,5,Racial,High,Outside on School Property,,1,16,Male,Black
11/29/72,Miami Northwest High School,Miami,FL,0,1,1,Escalation of Dispute,High,Off School Property,,1,,Male,
1/5/73,South Iredell High School,Statesville,NC,0,4,4,Racial,High,Outside on School Property,Handgun,1,,Male,Black
1/18/73,John Marshall High School,Los Angeles,CA,0,2,2,Robbery,High,Outside on School Property,Handgun,2,,Male,
1/31/73,Cumming High School,Burlington,NC,0,1,1,Illegal Drug Related,High,Inside School Building,Handgun,1,17,Male,
2/12/73,Booker T. Washington High SChool,Montgomery,AL,0,1,1,Escalation of Dispute,High,Inside School Building,Handgun,1,19,Male,
2/26/73,Armstrong High School,Richmond,VA,1,1,2,Escalation of Dispute,High,Inside School Building,Handgun,1,18,Male,Black
4/5/73,Locke High School,Los Angeles,CA,0,2,2,Gang-related,High,,Handgun,1,,Male,
5/1/73,Rayen High School,Youngtown,OH,0,3,3,Escalation of Dispute,High,Outside on School Property,Handgun,1,15,Male,
9/28/73,Wilson High School,Los Angeles,CA,0,4,4,Escalation of Dispute,High,Outside on School Property,Handgun,1,16,Male,
10/2/73,Elmhurst Wood Park Community High School,Almwood Park,IL,2,0,2,Murder/Suicide,High,Inside School Building,Handgun,1,17,Male,
10/19/73,Beaumont High School,St. Louis,MO,1,0,1,Gang-related,High,Inside School Building,,1,14,Male,
10/23/73,Sumner High School,St. Louis,MO,0,1,1,Gang-related,High,Outside on School Property,Combination of Different Types of Weapons,2,,,
10/23/73,Barberton High School,Barberton,OH,0,1,1,Escalation of Dispute,High,Inside School Building,Handgun,1,17,Male,White
10/24/73,Central High School,Minneapolis,MN,0,1,1,Escalation of Dispute,High,Outside on School Property,Shotgun,1,17,Male,
10/31/73,Northwestern High School,St. Louis,MO,0,1,1,,High,Outside on School Property,Shotgun,1,18,Male,
11/8/73,Woodell Phillips High School,Chicago,IL,1,0,1,Escalation of Dispute,High,Inside School Building,Handgun,1,16,Male,
11/9/73,Long Beach Polytechnic High School,Los Angeles,CA,1,1,2,Gang-related,High,Outside on School Property,,,,Male,
12/6/73,Fremont High School,Los Angeles,CA,0,1,1,Gang-related,High,Inside School Building,Handgun,1,,,
12/13/73,Hughes High School,Cincinnati,OH,0,1,1,Robbery,High,Inside School Building,Handgun,1,16,Male,
1/17/74,Barton Elementary School,Chicago,IL,1,3,4,Anger Over Grade/Suspension/Discipline,Elementary,Inside School Building,Multiple Handguns,1,14,Male,
1/22/74,Locke High School,Los Angeles,CA,1,0,1,Gang-related,High,Outside on School Property,,1,15,Male,
2/7/74,James Madison Junior High School,Oakland,CA,2,0,2,Indiscriminate Shooting,Junior High,Inside School Building,Handgun,1,24,Male,Black
3/22/74,Brownstown Central High School,Brownstown,IN,1,0,1,,High,Outside on School Property,Rifle,1,17,Male,White
4/2/74,St. Stephen's Parochial School,Bridgeport,CT,0,2,2,,Other,Inside School Building,Other,1,,,
5/10/74,Church Hill High School,Rogersville,TN,1,0,1,Escalation of Dispute,High,Outside on School Property,Handgun,1,20,Male,
5/19/74,Highlands Elementary School,Orlando,FL,0,0,0,Domestic w/ Targeted Victim,Elementary,Outside on School Property,Rifle,1,35,Male,
9/23/74,Jefferson High School,Daly City,CA,0,1,1,Escalation of Dispute,High,Inside School Building,Handgun,,,Male,
9/25/74,San Fernando High School,Los Angeles,CA,0,1,1,Escalation of Dispute,High,,Handgun,1,17,Male,
10/7/74,Destrehan High School,Hahnville,LA,1,1,2,Racial,High,School Bus,Handgun,1,17,Male,Black
10/21/74,Douglass High School,Baltimore,MD,0,1,1,Officer Involved Shooting,High,Inside School Building,Handgun,1,15,Male,
11/18/74,C. A. Brown High School,Charleston,SC,0,1,1,Gang-related,High,Outside on School Property,,,,Male,
11/21/74,Booker Junior High School,Little Rock,AR,1,1,2,Escalation of Dispute,Junior High,Inside School Building,Handgun,1,15,Male,
11/25/74,C. A. Brown High School,Charleston,SC,0,0,0,Gang-related,High,Outside on School Property,Handgun,2,,Male,
12/18/74,Manual Arts High School,Los Angeles,CA,1,1,2,Gang-related,High,,Handgun,1,17,Male,
12/30/74,Olean High School,Olean,NY,3,11,14,Indiscriminate Shooting,High,Inside School Building,Combination of Different Types of Weapons,1,17,Male,White
2/7/75,Board of Cooperative Educational Services,Minola,NY,0,1,1,Suicide/Attempted,Other,Inside School Building,Handgun,1,16,Male,
2/24/75,St. James School,Penns Grove,NJ,1,1,2,Mental Health,K-8,Inside School Building,Handgun,1,24,Male,
3/12/75,Jones High School,Houston,TX,0,2,2,Escalation of Dispute,High,Outside on School Property,Handgun,,,,
3/18/75,Sumner High School,St. Louis,MO,1,0,1,Escalation of Dispute,High,Inside School Building,,1,19,Male,
3/21/75,Fairmount Elementary School,Richmond,VA,0,1,1,Accidental,Elementary,Outside on School Property,Rifle,1,18,Male,
3/21/75,Patterson Cooperative High School,Dayton,OH,0,1,1,Robbery,High,Inside School Building,Handgun,1,15,Male,
5/15/75,Rock Junior High School,St. Louis,MO,0,1,1,Anger Over Grade/Suspension/Discipline,Junior High,Inside School Building,Handgun,1,13,Male,
5/27/75,Pitcher School,Detroit,MI,1,0,1,Escalation of Dispute,Other,Outside on School Property,Rifle,1,9,Male,
7/9/75,Dett Elementary School,Chicago,IL,0,1,1,Domestic w/ Targeted Victim,Elementary,Outside on School Property,,1,,Male,Black
7/11/75,Central High School,St. Louis,MO,0,2,2,Escalation of Dispute,High,School Bus,Handgun,1,18,Male,
9/11/75,Grant High School,Oklahoma City,OK,1,5,6,Racial,High,Inside School Building,,1,15,Male,White
10/1/75,Hermosa Elementary School,Artesia,NM,1,0,1,,Elementary,Inside School Building,Handgun,1,35,Male,
10/24/75,Murphy High School,Atlanta,GA,0,1,1,Anger Over Grade/Suspension/Discipline,High,Inside School Building,Handgun,1,15,,
12/18/75,Orange High School,Santa Ana,CA,0,1,1,Escalation of Dispute,High,Outside on School Property,Rifle,1,16,Male,
1/1/76,Camelback High School,Phoenix,AZ,0,1,1,Intentional Property Damage,High,Outside on School Property,Rifle,,,,
1/23/76,Columbus Central High School,Columbus,OH,1,1,2,,High,Inside School Building,Handgun,1,17,Male,
2/6/76,Escambia High School,Pensacola,FL,0,4,4,Racial,High,Outside on School Property,,,,,
2/12/76,Murray-Wright High School,Detroit,MI,0,5,5,Escalation of Dispute,High,Inside School Building,Handgun,2,,Male,
4/12/76,O. D. Wyatt High School,Fort Worth,TX,1,1,2,Escalation of Dispute,High,Inside School Building,Handgun,1,15,Male,
5/13/76,Mark Twain School,St. Louis,MO,0,1,1,Escalation of Dispute,Elementary,Inside School Building,Handgun,1,15,Male,
5/14/76,Palm Beach Gardens High School,West Palm Beach,FL,0,1,1,Escalation of Dispute,High,Outside on School Property,Handgun,1,17,Male,
6/2/76,Mt. Savage High School,Cumberland,MD,0,0,0,Intentional Property Damage,High,Outside on School Property,,,,,
9/20/76,Guildord County School Bus,Greensboro,NC,1,1,2,Suicide/Attempted,Other,School Bus,Shotgun,1,38,Male,
11/10/76,Burt Elementary School,Detroit,MI,1,0,1,Domestic w/ Targeted Victim,Elementary,Inside School Building,Handgun,1,46,Male,
12/10/76,Fremont School,St. Louis,MO,0,2,2,,Elementary,Inside School Building,Handgun,1,11,Male,
1/13/77,Old Main Eisenhower High School,Blue Island,IL,0,1,1,Escalation of Dispute,High,Inside School Building,Handgun,1,15,Male,
2/9/77,Fenger High School,Chicago,IL,1,3,4,Escalation of Dispute,High,Inside School Building,Handgun,1,14,Male,
2/28/77,Horace Mann Junior High School,Amarillo,TX,0,1,1,Escalation of Dispute,Junior High,Inside School Building,Handgun,1,15,Male,
2/28/77,Roosevelt High School,St. Louis,MO,0,2,2,Escalation of Dispute,High,,,1,19,Male,
3/8/77,Collinsville High School,Edwardsville,IL,0,2,2,Anger Over Grade/Suspension/Discipline,High,Inside School Building,Handgun,1,16,Male,
3/21/77,Parochial School,Hamburg,NY,0,0,0,Accidental,Other,Outside on School Property,Rifle,1,18,Male,
4/7/77,Whitharral High School,Whitharral,TX,1,0,1,Mental Health,High,Outside on School Property,Handgun,1,17,Male,
4/18/77,Pioneer Christian Academy,Nashville,TN,1,0,1,Domestic w/ Targeted Victim,Other,Outside on School Property,Handgun,1,46,Male,
5/17/77,Stone Middle School,Cocoa,FL,0,0,0,Intentional Property Damage,Middle,Outside on School Property,Rifle,1,22,Male,
6/22/77,Holy Trinity High School,Chicago,IL,0,2,2,Escalation of Dispute,High,Outside on School Property,,,,,
7/11/77,South Junior High School,Colorado Springs,CO,0,1,1,,Junior High,Outside on School Property,Handgun,,,,
11/29/77,Vashon High School,St. Louis,MO,0,1,1,,High,Inside School Building,,1,18,Male,
11/29/77,Hazelwood Central Senior High School,St. Louis,MO,0,0,0,Indiscriminate Shooting,High,Outside on School Property,Rifle,1,19,Male,
12/9/77,Petaluma McNear Elementary,Santa Rosa,CA,0,0,0,Domestic w/ Targeted Victim,Elementary,Inside School Building,Handgun,1,40,Male,
12/12/77,West Orange High School,Winter Garden,FL,1,0,1,Escalation of Dispute,High,Inside School Building,Handgun,1,41,Male,
12/15/77,Blue Hills Vocational High School,Canton,MA,0,2,2,,High,Inside School Building,,1,,Male,
1/11/78,Christian County Middle School,Hopkinsville,KY,0,1,1,Escalation of Dispute,Middle,Inside School Building,Handgun,1,16,Male,
2/9/78,Hayes Junior High School,St. Albans,WV,1,0,1,Bullying,Junior High,Inside School Building,Handgun,1,15,Male,White
2/22/78,Everett High School,Lansing,MI,1,1,2,Bullying,High,Inside School Building,Handgun,1,15,Male,White
3/9/78,Monroe Elementary School,Santa Rosa,CA,0,1,1,Accidental,Elementary,Inside School Building,Rifle,1,14,Male,
3/29/78,Gallatin Junior High School,Nashville,TN,0,1,1,Racial,Junior High,Inside School Building,Handgun,1,,Male,Black
4/14/78,Fordson High School,Detroit,MI,0,1,1,,High,Inside School Building,Handgun,1,16,Male,
4/26/78,Paul Dunbar Elementary School,Dallas,TX,1,0,1,Anger Over Grade/Suspension/Discipline,Elementary,Inside School Building,Handgun,1,56,Female,
4/28/78,Ridgewood High School,Norridge,IL,2,2,4,,High,Outside on School Property,Handgun,1,,Male,
5/18/78,Murchison Junior High School,Austin,TX,1,0,1,Mental Health,Junior High,Inside School Building,Rifle,1,13,Male,White
5/19/78,Downtown Junior High School,Philadelphia,PA,0,8,8,,Junior High,School Bus,Multiple Rifles,,,,
6/7/78,Dover Air High,Dover,DE,1,0,1,Accidental,High,Off School Property,Handgun,1,17,Male,
6/10/78,Weymouth South High School,Weymouth,MA,0,0,0,Suicide/Attempted,High,Outside on School Property,Handgun,1,17,Male,
10/17/78,Lanett Junior High School,Lanett,AL,0,1,1,Anger Over Grade/Suspension/Discipline,Junior High,Inside School Building,Handgun,1,13,Male,White
10/17/78,University City High School,University City,MO,0,3,3,Escalation of Dispute,High,Outside on School Property,Handgun,1,,Male,White
11/29/78,Park West High School,New York,NY,0,1,1,Accidental,High,Inside School Building,Handgun,1,15,Male,
12/14/78,Wilbur Cross High School,New Haven,CT,1,0,1,Robbery,High,Inside School Building,Handgun,1,17,Male,
1/29/79,Grover Cleveland Elementary School,San Diego,CA,3,8,11,Mental Health,Elementary,Outside on School Property,Rifle,1,16,Female,White
3/14/79,McArthur High School North,Miami,FL,0,1,1,Robbery,High,Outside on School Property,Handgun,1,,Male,Black
3/28/79,Los Angeles High School,Los Angeles,CA,0,1,1,Robbery,High,Inside School Building,Handgun,1,19,Male,
4/16/79,Wisconsin Lutheran High School,Milwaukee,WI,0,1,1,Self Defense,High,Outside on School Property,Shotgun,1,28,Male,
4/25/79,Martin L. Mattei Junior High School,Hughestown,PA,0,1,1,Accidental,Junior High,Outside on School Property,Rifle,1,,,
4/26/79,Azle Junior High School,Azle,TX,1,0,1,Escalation of Dispute,High,Outside on School Property,Handgun,1,14,Male,
6/14/79,New Carlisle Elementary School,New Carlisle,OH,1,0,1,Accidental,Elementary,Outside on School Property,Handgun,1,13,Male,
9/26/79,Carter G. Woodson Middle School,New Orleans,LA,0,2,2,Escalation of Dispute,Middle,Inside School Building,Handgun,2,,Male,
9/28/79,Charlestown High School,Charlestown,MA,0,1,1,Racial,High,Outside on School Property,Rifle,1,,Male,White
10/23/79,O'Fallen Technical High School,St. Louis,MO,0,2,2,Escalation of Dispute,High,Inside School Building,Handgun,1,16,Male,
11/5/79,Washington High School,Indianapolis,IN,0,1,1,,High,Outside on School Property,Handgun,1,18,Male,
11/30/79,Not listed,Lewisville,TX,0,1,1,,,Inside School Building,Handgun,1,14,Male,
12/3/79,Eastern High School,Baltimore,MD,0,3,3,Gang-related,High,Inside School Building,Handgun,4,,Male,
12/21/79,Blewett Middle School,St. Louis,MO,0,1,1,Escalation of Dispute,Middle,Inside School Building,Handgun,1,14,Male,
1/7/80,Stamps High School,Stamps,AR,1,0,1,Mental Health,High,Inside School Building,Handgun,1,16,Male,White
1/29/80,Lafayette High School,Williamsburg,VA,0,1,1,Suicide/Attempted,High,Inside School Building,Handgun,1,17,Male,
2/1/80,Langdon Elementary School,"Washington, DC",DC,0,1,1,Accidental,Elementary,Inside School Building,Handgun,1,9,Male,
2/7/80,Valley View Elementary School,Longview,TX,0,1,1,Accidental,Elementary,Inside School Building,Handgun,1,9,Male,
2/11/80,Arsenal Technical High School,Indianapolis,IN,0,1,1,Illegal Drug Related,High,Outside on School Property,Handgun,2,,Male,
2/15/80,Hughes School,McComb,MS,1,0,1,Domestic w/ Targeted Victim,Other,Outside on School Property,Handgun,1,32,Male,
3/20/80,J. Leslie Patton School,Dallas,TX,1,0,1,Domestic w/ Targeted Victim,High,Inside School Building,Handgun,1,30,Male,
3/31/80,Frederick Douglass Senior High School,Baltimore,MD,0,1,1,Escalation of Dispute,High,Inside School Building,Handgun,1,16,Male,Black
4/17/80,Capeville Elementary School,Capeville,VA,2,0,2,Domestic w/ Targeted Victim,Elementary,Inside School Building,Handgun,1,53,Male,
5/30/80,Clara Barton High School,Brooklyn,NY,0,1,1,Accidental,High,Inside School Building,Handgun,1,15,Male,
9/2/80,Whittier High School,Los Angeles,CA,0,10,10,Gang-related,High,Outside on School Property,Shotgun,1,18,Male,White
9/8/80,Forrest HIgh School,Jacksonville,FL,0,1,1,Escalation of Dispute,High,Outside on School Property,Handgun,1,,Male,
9/10/80,Springarn High School,Washington,DC,1,0,1,Accidental,High,Inside School Building,Handgun,1,18,Male,
9/11/80,John S. Shaw High School,Mobile,AL,1,0,1,Escalation of Dispute,High,Inside School Building,Handgun,1,29,Female,
9/26/80,Bridgeport Central High School,Bridgeport,CT,0,2,2,Indiscriminate Shooting,High,Outside on School Property,Rifle,1,19,Male,
10/13/80,Central High School,Tuscaloosa,AL,0,1,1,,High,,Handgun,1,17,Male,
10/31/80,Hueytown High School,Hueytown,AL,1,1,2,Escalation of Dispute,High,Inside School Building,Handgun,1,17,Male,
11/17/80,Eastern Hills High School,Fort Worth,TX,0,1,1,Escalation of Dispute,High,Outside on School Property,Handgun,1,16,Male,
12/12/80,Longfellow Junior HIgh School,Lorain,OH,0,1,1,Hostage Standoff,Junior High,Inside School Building,Handgun,1,14,Male,
12/12/80,Parker High School,Birmingham,AL,0,1,1,,High,Inside School Building,Handgun,1,15,Male,
1/21/81,Willetts Middle School,Brunswick,OH,0,1,1,,Junior High,Inside School Building,Handgun,1,14,Male,White
1/22/81,Francis M. Wood Senior High School,Baltimore,MD,0,0,0,Escalation of Dispute,High,Inside School Building,Handgun,1,17,Male,
2/10/81,Manuel Arts High School,Los Angeles,CA,1,0,1,Gang-related,High,Outside on School Property,Shotgun,1,19,Male,
2/10/81,Little Rock Hall High School,Little Rock,AR,0,1,1,Escalation of Dispute,High,Outside on School Property,Handgun,1,16,Male,
3/3/81,Marshall High School ,Indianapolis,IN,0,1,1,Escalation of Dispute,High,Inside School Building,Handgun,1,15,Male,
3/28/81,Dillard High School,Fort Lauderdale,FL,1,0,1,Escalation of Dispute,High,Outside on School Property,Handgun,1,18,Male,
4/2/81,Alexander Hamilton Junior High School,Cleveland,OH,0,1,1,Escalation of Dispute,Junior High,Inside School Building,Handgun,1,14,Male,
4/7/81,Poplarville High School,Poplarville,MS,0,1,1,,High,Outside on School Property,,1,,,
5/15/81,New Iberia Junior HIgh School,New Iberia,LA,0,1,1,Domestic w/ Targeted Victim,Junior High,Inside School Building,Handgun,1,42,Male,
9/8/81,Stuart Middle School,West Palm Beach,FL,0,1,1,Accidental,Middle,Inside School Building,Handgun,1,12,Male,
9/1/81,William Longstreth Elementary School,Philadelphia,PA,0,3,3,Gang-related,Elementary,Outside on School Property,Handgun,1,,Male,
9/4/81,Hobbs High School,Santa Fe,NM,0,2,2,,High,Outside on School Property,Handgun,1,16,Male,
9/13/81,Aberdeen High School,Aberdeen,MD,1,0,1,Officer Involved Shooting,High,,Handgun,,,,
10/13/81,Hartford Public High School,Hartford,CT,0,1,1,Escalation of Dispute,High,Inside School Building,Handgun,1,16,Male,
12/9/81,George W. Wingate High School,Brooklyn,NY,1,0,1,Robbery,High,Outside on School Property,Handgun,1,,Male,
12/16/81,Unnamed school,Houston,TX,0,1,1,Escalation of Dispute,High,Inside School Building,Handgun,1,17,Male,
12/23/81,James Madison High School,Brooklyn,NY,1,0,1,Escalation of Dispute,High,Inside School Building,Handgun,1,,Male,
2/5/82,Hamilton High School,Memphis,TN,1,0,1,Robbery,High,Inside School Building,Handgun,1,,Male,
2/8/82,Dorchester High School,Dorchester,MA,0,1,1,Accidental,High,Inside School Building,Handgun,1,19,Male,Black
2/9/82,John McDonough Senior High,New Orleans,LA,1,1,2,Escalation of Dispute,High,Inside School Building,,2,,Male,
3/15/82,Springfield High School,Springfield,OR,1,0,1,Suicide/Attempted,High,Inside School Building,Handgun,1,14,Male,
3/17/82,Lorain High School,Lorain,OH,0,1,1,Suicide/Attempted,High,Inside School Building,Handgun,1,17,Male,
3/19/82,Valley High School,Las Vegas,NV,1,2,3,Mental Health,High,Inside School Building,Handgun,1,17,Male,Black
4/7/82,Deer Creek Junior High School,Littleton,CO,1,0,1,,High,Outside on School Property,Handgun,1,14,Male,White
4/15/82,Forest Park Senior High School,Baltimore,MD,0,1,1,Robbery,High,Inside School Building,Handgun,1,,Male,
4/29/82,Russell High School,East Point,GA,1,0,1,Accidental,High,Inside School Building,Rifle,1,16,Male,White
4/30/82,Anniston High School,Anniston,FL,0,1,1,Escalation of Dispute,High,Outside on School Property,Handgun,1,19,Male,
5/27/82,Garside Junior High School,Las Vegas,NV,0,2,2,,Junior High,Outside on School Property,Other,1,,Male,
9/10/82,Lake Braddock Secondary School,Burke,VA,0,0,0,Domestic w/ Targeted Victim,Other,Inside School Building,,1,18,Male,
9/15/82,South West Middle School,Pine Bluff,AR,0,1,1,Suicide/Attempted,Middle,Inside School Building,Handgun,1,12,Male,
11/1/82,Elmont Memorial High School,Elmont,NY,0,1,1,Escalation of Dispute,High,Inside School Building,Handgun,1,16,Male,
11/8/82,Cooley High School,Detroit,MI,0,2,2,Accidental,High,Inside School Building,Handgun,1,15,Male,
11/12/82,Wingfield High School,Jackson,MS,2,0,2,Murder/Suicide,High,Inside School Building,Shotgun,1,20,Male,
12/6/82,Huntsville High School,Huntsville,AL,1,0,1,Suicide/Attempted,High,Inside School Building,Handgun,1,17,Male,
