Date,School,City,State,Killed (includes shooter),Wounded,Total Injured/Killed Victims,Category,School Type,Location,Firearm Type,Number of Shooters,Shooter Age,Shooter Gender,Race
2/9/06,William Penn High School,New Castle,DE,0,1,1,Escalation of Dispute,High,Outside on School Property,Handgun,1,,Male,
2/15/06,West York Area High School,York,PA,1,0,1,Suicide/Attempted,High,Inside School Building,Handgun,1,,Male,
2/21/06,Westinghouse High School,Pittsburgh,PA,0,1,1,Illegal Drug Related,High,Outside on School Property,Rifle,1,23,Male,
2/23/06,Roseburg High School,Roseburg,OR,0,1,1,Escalation of Dispute,High,Inside School Building,Handgun,1,14,Male,White
3/10/06,I.S. 89 Middle School,New York,NY,0,2,2,,Middle,Inside School Building,Other,2,,Male,
3/14/06,Pine Middle School,Reno,NV,0,2,2,Bullying,Middle,Inside School Building,Handgun,1,14,Male,White
4/5/06,Roosevelt Senior High School,Washington,DC,0,2,2,,High,Outside on School Property,,1,,,
4/18/06,Westbury High School (bus),Houston,TX,0,2,2,,12-Jun,School Bus,Handgun,1,,Male,
4/24/06,East Chapel Hill High School,Chapel Hill,NC,0,0,0,Hostage Standoff,High,Inside School Building,Shotgun,1,17,Male,
5/5/06,Parkway Academy,Miramar,FL,1,0,1,Escalation of Dispute,High,Outside on School Property,Handgun,1,,Male,
5/22/06,Butch Fork High School,Irmo,SC,0,0,0,Domestic w/ Targeted Victim,High,Outside on School Property,Handgun,1,19,Male,
5/25/06,Northampton Area Senior High School,Northampton,PA,0,0,0,,High,Inside School Building,Rifle,1,18,Male,
6/5/06,Venice High School,Los Angeles,CA,1,0,1,Robbery,High,Outside on School Property,Handgun,1,,Male,Black
6/6/06,Wirt High School,Gary,IN,1,0,1,Escalation of Dispute,High,Inside School Building,Handgun,1,19,Male,
6/15/06,Pershing High School,Detroit,MI,0,1,1,Escalation of Dispute,High,Outside on School Property,Handgun,1,,Male,
7/31/06,Young Middle Magnet School,Tampa,FL,2,0,2,Murder/Suicide,Middle,Outside on School Property,Handgun,1,54,Male,
8/15/06,J. T. Alton Middle School,Vine Grove,KY,0,0,0,Accidental,Middle,Inside School Building,Handgun,1,13,Male,
8/17/06,Mendez Middle School,Austin,TX,1,0,1,Gang-related,Middle,Outside on School Property,Handgun,2,,Male,
8/19/06,South High School,Youngstown,OH,1,0,1,Escalation of Dispute,High,Outside on School Property,Handgun,1,25,Male,
8/20/06,Lyman Hall Elementary School,Hinesville,GA,0,2,2,Escalation of Dispute,High,Outside on School Property,Handgun,1,,Male,
8/21/06,Castle High School,Newburgh,IN,1,0,1,Suicide/Attempted,High,Outside on School Property,Handgun,1,16,Male,
8/24/06,Essex Elementary School,Essex Junction,VT,1,1,2,Domestic w/ Targeted Victim,Elementary,Inside School Building,Handgun,1,26,Male,Black
8/29/06,Anacostia Senior High School,Washington,DC,0,0,0,,High,Outside on School Property,Handgun,1,16,Male,
8/30/06,Orange High School,Hillsborough,NC,0,2,2,Indiscriminate Shooting,High,Outside on School Property,Combination of Different Types of Weapons,1,18,Male,Some Other
8/31/06,Oxford High School,Oxford,AL,0,1,1,Escalation of Dispute,High,Outside on School Property,Handgun,1,21,Male,
9/5/06,Kingsbury Middle School,Memphis,TN,0,1,1,Escalation of Dispute,Middle,Outside on School Property,Handgun,1,,,
9/8/06,South Hills High School,Fort Worth,TX,0,1,1,Officer Involved Shooting,High,Outside on School Property,Handgun,,,,
9/13/06,Westminster Christian Academy,Creve Coeur,MO,0,1,1,Officer Involved Shooting,High,Outside on School Property,Handgun,,,,
9/21/06,Cardozo High School,Washington,DC,0,1,1,Escalation of Dispute,High,Outside on School Property,Handgun,1,17,Male,
9/27/06,Platte Canyon High School,Bailey,CO,2,0,2,Hostage Standoff,High,Inside School Building,Multiple Handguns,1,53,Male,White
9/29/06,Weston High School,Cazenovia,WI,1,0,1,Indiscriminate Shooting,High,Inside School Building,Combination of Different Types of Weapons,1,15,Male,White
10/2/06,West Nickel Mines School,Nickel Mines,PA,6,5,11,Indiscriminate Shooting,K-12,Inside School Building,Combination of Different Types of Weapons,1,32,Male,White
10/9/06,Memorial Middle School,Joplin,MO,0,0,0,Anger Over Grade/Suspension/Discipline,Middle,Inside School Building,Rifle,1,13,Male,White
10/10/06,Ponoma Middle School ,Pomona,NY,0,2,2,,Middle,School Bus,Other,1,,Male,
10/12/06,Grove Park Elementary School,Baltimore,MD,0,0,0,Accidental,Elementary,Inside School Building,Handgun,1,8,Male,
10/17/06,Seven Lakes High School,Katy,TX,1,0,1,Accidental,High,Inside School Building,,1,16,Female,
10/31/06,Halls High School,Knoxville,TN,1,0,1,Robbery,High,Outside on School Property,Handgun,1,39,Male,
11/11/06,Lionel Wilson College Prep School,Oakland,CA,1,1,2,Escalation of Dispute,High,Inside School Building,Handgun,1,,Male,
11/22/06,Sammye E. Coan Middle School,Atlanta,GA,1,0,1,,Middle,Outside on School Property,Handgun,1,,Male,
12/1/06,Jones Senior High School,Trenton,NC,1,0,1,Gang-related,High,Outside on School Property,Handgun,1,20,Male,
12/7/06,Northwest High School,Omaha,NE,0,1,1,Accidental,High,Inside School Building,Handgun,1,17,Male,
12/11/06,Clemente High School,Chicago,IL,0,1,1,Gang-related,High,Outside on School Property,Handgun,1,17,Male,
12/12/06,Springfield Township High School,Springfield Township,PA,1,0,1,Suicide/Attempted,High,Inside School Building,Rifle,1,16,Male,
12/13/06,Bangor Area High School,Bangor,PA,0,1,1,,High,Outside on School Property,Other,1,,Male,
12/14/06,McGuffey High School,Claysville,PA,1,0,1,Suicide/Attempted,High,Inside School Building,Rifle,1,17,Male,White
1/2/07,Westover High School,Fayetteville,NC,0,0,0,Escalation of Dispute,High,Outside on School Property,Handgun,1,14,Male,
1/3/07,Henry Foss High School,Tacoma,WA,1,0,1,Mental Health,High,Inside School Building,Handgun,1,18,Male,Some Other
1/4/07,Northwestern High School,Detroit,MI,0,1,1,,High,Outside on School Property,,1,,Male,
1/8/07,Robert A. Taft Information Technology High School,Cincinnati,OH,0,0,0,,High,Inside School Building,Multiple Handguns,1,16,Male,
1/9/07,Western High School,Las Vegas,NV,0,2,2,Escalation of Dispute,High,Outside on School Property,Handgun,1,,Male,
1/9/07,Grant High School,Van Nuys,CA,0,2,2,Gang-related,High,Outside on School Property,,,,Male,
1/18/07,William L.Sayre High School,Philadelphia,PA,0,1,1,Escalation of Dispute,High,Outside on School Property,Handgun,,,Male,
1/24/07,Harbin County High School,Savannah,TN,0,1,1,Suicide/Attempted,High,Inside School Building,Handgun,1,17,Male,
1/31/07,Hillcrest High School,Country Club Hills,IL,0,1,1,Escalation of Dispute,High,Outside on School Property,Handgun,1,,Male,
2/7/07,Paxon Middle School,Jacksonville,FL,0,0,0,Escalation of Dispute,Middle,,Handgun,1,16,Male,
2/8/07,Crook County High School,Prineville,OR,1,0,1,Suicide/Attempted,High,Outside on School Property,Handgun,1,18,Male,
2/8/07,Stephen F. Austin Middle School,Port Arthur,TX,0,0,0,Accidental,Middle,Inside School Building,Other,1,,Male,
2/26/07,Slauson Middle School,Azusa,CA,0,2,2,,Middle,Inside School Building,Other,1,12,Male,
2/27/07,Clifton Elementary School,Atlanta,GA,0,1,1,,Elementary,Inside School Building,Other,1,10,Male,
3/7/07,Greenville High School,Greenville,TX,1,0,1,Suicide/Attempted,High,Inside School Building,,1,16,Male,
3/7/07,Herbert Henry Dow High School,Midland,MI,1,1,2,Murder/Suicide,High,Outside on School Property,Handgun,1,17,Male,
3/7/07,Centennial High School,Compton,CA,0,1,1,Gang-related,High,Outside on School Property,Handgun,1,,Male,
3/8/07,East Ridge High School,Chattanooga,TN,0,1,1,Suicide/Attempted,High,Inside School Building,Handgun,1,62,Male,
3/23/07,Union Park Elementary School,Orlando,FL,0,1,1,Bullying,Elementary,Inside School Building,Other,1,10,Male,
3/27/07,Sarah J. Rawson Elementary School,Hartford,CT,0,1,1,,Elementary,Outside on School Property,Handgun,1,,Male,
3/29/07,Myrtle Beach High School,Myrtle Beach,SC,0,1,1,Accidental,High,Inside School Building,Handgun,1,18,Male,
4/10/07,Chicago Vocational Career Academy,Chicago,IL,0,1,1,Accidental,Other,Inside School Building,Handgun,1,15,Male,
4/10/07,Springwater Trail High School,Gresham,OR,0,10,10,Indiscriminate Shooting,High,Outside on School Property,Rifle,1,15,Male,
4/18/07,North Mecklenburg High School,Huntersville,NC,1,0,1,Suicide/Attempted,High,Outside on School Property,Handgun,1,16,Male,
5/3/07,Gettysburg Elementary School,Dayton,OH,0,1,1,,Elementary,School Bus,Other,1,16,Male,
5/4/07,Tidehaven High School,El Maton,TX,1,0,1,Suicide/Attempted,High,Inside School Building,Handgun,1,15,Female,
5/10/07,Henry Ford High School,Detroit,MI,0,2,2,Gang-related,High,Outside on School Property,,1,,,
5/12/07,West Mesquite High School,Mesquite,TX,0,1,1,Escalation of Dispute,High,Outside on School Property,Shotgun,1,17,Male,
5/15/07,Liberty Memorial Middle School,Los Fresnos,TX,0,0,0,,Middle,Inside School Building,Handgun,1,14,Male,
5/23/07,Oak Haven Elementary School,Coventry,RI,0,1,1,Bullying,Elementary,Outside on School Property,Other,1,11,Male,
5/30/07,Vandora Springs Elementary School,Garner,NC,0,1,1,,Elementary,Outside on School Property,Other,1,,Male,
5/31/07,North Garner Middle School,Garner,NC,0,3,3,,Middle,Outside on School Property,Other,1,,Male,
6/17/07,Broad River Elementary School,Burton,SC,0,1,1,Escalation of Dispute,Elementary,Outside on School Property,Handgun,1,21,Male,
6/28/07,David W. Carter High School,Dallas,TX,0,2,2,Gang-related,High,Outside on School Property,Handgun,1,17,Male,
7/9/07,Carter G. Woodson Elementary School,Chicago,IL,0,2,2,Gang-related,Elementary,Outside on School Property,,1,,Male,
8/4/07,Mount Vernon Elementary School,Newark,NJ,3,1,4,Gang-related,High,Outside on School Property,Handgun,1,19,Male,
9/28/07,Las Plumas High School,Oroville,CA,0,0,0,Hostage Standoff,High,Inside School Building,Handgun,1,17,Male,White
9/30/07,SS> Simon and Jude Catholic School,Phoenix,AZ,0,2,2,Escalation of Dispute,K-8,Outside on School Property,,1,18,Male,Some Other
10/1/07,Platt High School,Meriden,CT,0,1,1,,High,Outside on School Property,Other,1,15,Male,
10/10/07,SuccessTech Academy,Cleveland,OH,1,4,5,Anger Over Grade/Suspension/Discipline,Other,Inside School Building,Multiple Handguns,1,14,Male,White
10/24/07,Manassas High School,Memphis,TN,0,1,1,Accidental,High,Inside School Building,Handgun,1,15,Male,
11/5/07,John Curtis Christian School,River Ridge,LA,1,0,1,Suicide/Attempted,K-12,Inside School Building,Handgun,1,13,Male,
11/26/07,Holland Patent Central High School,Holland Patent,NY,0,0,0,Intentional Property Damage,High,Outside on School Property,Handgun,1,17,Male,White
12/21/07,Barnard-White Middle School,Union City,CA,1,0,1,Gang-related,Middle,Outside on School Property,,1,21,Male,Some Other
2/4/08,Hamilton High School,Memphis,TN,0,1,1,Escalation of Dispute,High,Inside School Building,Handgun,1,16,Male,Black
2/11/08,Mitchell High School,Memphis,TN,0,1,1,Escalation of Dispute,High,Inside School Building,Handgun,1,17,Male,
2/12/08,E.O. Green Junior High School,Oxnard,CA,1,0,1,Bullying,Junior High,Inside School Building,Handgun,1,14,Male,
3/6/08,Davidson High School,Mobile,AL,1,0,1,Suicide/Attempted,High,Inside School Building,Handgun,1,18,Male,
4/16/08,Roosevelt High School,Fresno,CA,1,0,1,Officer Involved Shooting,High,Outside on School Property,Handgun,,,,
5/16/08,Madison Parish High School,Tallulah,LA,1,0,1,Suicide/Attempted,High,Outside on School Property,,1,,,
8/11/08,Wallace Elementary School,Kelso,WA,0,0,0,Illegal Drug Related,Elementary,Outside on School Property,Handgun,1,49,Male,
8/14/08,Lakota Middle School,Federal Way,WA,1,0,1,Gang-related,Middle,Outside on School Property,Handgun,1,17,Male,Some Other
8/21/08,Central High School,Knoxville,TN,1,0,1,Escalation of Dispute,High,Inside School Building,Handgun,1,15,Male,Some Other
9/2/08,South High School,Willoughby,OH,0,0,0,Suicide/Attempted,High,Inside School Building,Handgun,1,15,Male,
9/15/08,Mira Loma High School,Sacramento,CA,1,0,1,Suicide/Attempted,High,Inside School Building,Handgun,1,17,Male,
9/19/08,George Washington Preparatory High School,Athens,CA,0,2,2,Gang-related,High,Outside on School Property,,,,Male,
10/16/08,Henry Ford High School,Detroit,MI,1,3,4,Gang-related,High,Outside on School Property,,1,15,Male,Black
10/20/08,Vasquez High School,Acto,CA,1,0,1,Suicide/Attempted,High,Inside School Building,Handgun,1,14,Male,White
10/23/08,Prattville Christian Academy,Prattville,AL,0,1,1,Domestic w/ Targeted Victim,Other,Outside on School Property,Handgun,1,50,Male,
10/29/08,Eliot Elementary School,Gilroy,CA,0,1,1,,Elementary,Inside School Building,Other,1,10,Male,
10/31/08,Stockton Springs Elementary School,Stockton Springs,MA,0,0,0,Hostage Standoff,Elementary,Inside School Building,,1,55,Male,
11/3/08,El Rio Elementary School,Oxnard,CA,0,0,0,,Elementary,Outside on School Property,Other,,,,
11/3/08,Bell High School,Bell,CA,1,0,1,,High,Inside School Building,Handgun,1,,,
11/12/08,Dillard High School,Fort Lauderdale,FL,1,0,1,Domestic w/ Targeted Victim,High,Inside School Building,Handgun,1,15,Female,Black
11/15/08,Thompson Valley High School,Loveland,CO,1,0,1,Escalation of Dispute,High,Outside on School Property,Handgun,1,18,Male,
11/15/08,Desert Hills High School,St. George,UT,1,0,1,Accidental,High,Inside School Building,Handgun,1,15,Male,
11/18/08,Cole Middle School,Oakland,CA,0,0,0,,Middle,Inside School Building,Handgun,1,13,Male,
11/18/08,Central Valley High School,Ceres,CA,0,1,1,Escalation of Dispute,High,Outside on School Property,Handgun,1,18,Male,
11/25/08,North Forest High School,Houston,TX,0,1,1,,High,Outside on School Property,,1,18,Male,
11/30/08,O. A. Peters Elementary School,Garden Grove,CA,0,1,1,Gang-related,Elementary,Outside on School Property,Handgun,1,,Male,
12/2/08,King City High School,King City,CA,1,1,2,Gang-related,High,Outside on School Property,Handgun,1,17,Male,
12/5/08,Shattuck St. Mary's Prep School,Faribault,MN,1,0,1,Suicide/Attempted,Other,Inside School Building,Handgun,1,34,Male,
12/12/08,William Floyd High School,Mastic Beach,NY,0,1,1,Escalation of Dispute,High,Outside on School Property,Handgun,1,27,Male,Black
12/12/08,Guy B. Teachey Elementary School,Asheboro,NC,1,0,1,Accidental,Elementary,Outside on School Property,Handgun,1,16,Female,
12/21/08,Summerville High School,Summerville,SC,0,1,1,Escalation of Dispute,High,Outside on School Property,Handgun,1,22,Male,
12/22/08,Largo Middle School,Largo,FL,1,0,1,Suicide/Attempted,Middle,Outside on School Property,Handgun,1,47,Female,White
12/27/08,William H. Harrison Elementary School,Philadelphia,PA,0,2,2,,Elementary,Outside on School Property,,1,,,
12/31/08,Shuman Middle School,Savannah,GA,0,1,1,Escalation of Dispute,Middle,Outside on School Property,Shotgun,1,18,Female,
12/31/08,Kennedy Elementary School,Norman,OK,1,0,1,Suicide/Attempted,Elementary,Outside on School Property,,1,68,Male,
1/8/09,William Penn High School,New Castle,DE,0,2,2,Accidental,High,Inside School Building,Handgun,1,,Female,
1/9/09,Dunbar High School,Chicago,IL,0,6,6,Gang-related,High,Outside on School Property,Handgun,1,18,Male,Black
1/14/09,Perspectives Charter School,Chicago,IL,0,3,3,,Middle,School Bus,,1,,,
1/20/09,Beecher High School,Mount Morris Township,MI,0,4,4,Escalation of Dispute,High,Outside on School Property,Multiple Handguns,1,18,Male,
1/20/09,Collins HIgh School,Chicago,IL,0,1,1,Escalation of Dispute,High,Outside on School Property,Handgun,2,16,Male,
1/20/09,East High School,Erie,PA,0,1,1,Escalation of Dispute,High,Inside School Building,Handgun,1,15,Male,Some Other
1/23/09,Cahokia High School,Cahokia,IL,1,0,1,Escalation of Dispute,High,Outside on School Property,Handgun,1,18,Male,
1/27/09,Clayton High School,Clayton,NC,0,0,0,Gang-related,High,Outside on School Property,Handgun,1,18,Male,Black
2/10/09,Baker Elementary School,El Monte,CA,0,0,0,Accidental,Elementary,Outside on School Property,Handgun,1,9,Male,
2/11/09,School bus,Zebulon,NC,0,1,1,Accidental,Other,School Bus,Handgun,1,11,Male,
2/17/09,Central High School,Detroit,MI,0,2,2,Escalation of Dispute,High,Inside School Building,Handgun,2,,Male,
2/20/09,John Muir Elementary School,Hayward,CA,0,0,0,,Elementary,Outside on School Property,Shotgun,1,,Male,
2/23/09,Brien McMahon High School,Norwalk,CT,0,1,1,Gang-related,High,Outside on School Property,Handgun,1,,,
3/2/09,Robert Frost Elementary School,Sioux Falls,SD,0,0,0,Escalation of Dispute,Elementary,Outside on School Property,Other,1,10,Male,
3/6/09,Westover High School,Fayetteville,NC,0,1,1,Escalation of Dispute,High,Outside on School Property,,1,19,Male,
3/10/09,Ribault High School,Jacksonville,FL,0,0,0,Escalation of Dispute,High,Inside School Building,Handgun,2,,Male,
3/11/09,Cypress Ridge High School,Houston,TX,0,0,0,Accidental,High,Inside School Building,Handgun,1,,Male,
4/13/09,Locke HIgh School,Los Angeles,CA,0,1,1,Gang-related,High,Outside on School Property,Handgun,1,,Male,Some Other
5/1/09,Sheboygan High School,Sheboygan,WI,1,0,1,Suicide/Attempted,High,Outside on School Property,,1,17,Male,
5/5/09,Canandaigua Academy,Canandaigua,NY,1,0,1,Suicide/Attempted,High,Inside School Building,Shotgun,1,17,Male,White
5/18/09,Larose-Cut Off Middle School,Larose,LA,1,0,1,Indiscriminate Shooting,Middle,Inside School Building,Handgun,1,15,Male,White
6/15/09,International Studies Academy,San Francisco,CA,0,3,3,Gang-related,Other,Outside on School Property,Handgun,1,,Male,
6/24/09,Aplington-Parkersburg High School,Parkersburg,IA,1,0,1,Mental Health,High,Inside School Building,Handgun,1,24,Male,White
8/27/09,Westover High School,Fayetteville,NC,0,0,0,Escalation of Dispute,High,Outside on School Property,Handgun,1,16,Male,
9/8/09,Stamford Academy,Stamford,CT,0,0,0,Escalation of Dispute,High,Outside on School Property,Handgun,1,16,Male,
9/16/09,Virginia Randolph Community High School,Glen Allen,VA,0,0,0,Bullying,High,Inside School Building,Handgun,1,16,Male,
10/8/09,Mattituck Junior-Senior High School,Mattituck,NY,0,1,1,Accidental,12-Jun,Inside School Building,Rifle,1,28,Male,
10/16/09,Carolina Forest High School,Conway,SC,1,0,1,Officer Involved Shooting,High,Inside School Building,Handgun,,,,
10/30/09,Wilson High School,Long Beach,CA,1,2,3,Gang-related,High,Outside on School Property,Shotgun,1,18,Male,Black
11/6/09,Hamilton High School (bus),West Philadelphia,PA,0,1,1,Bullying,High,School Bus,Handgun,1,15,Male,
12/11/09,Booker T. Washington High School,Shreveport,LA,0,1,1,Domestic w/ Targeted Victim,High,Outside on School Property,Handgun,1,28,Male,
1/20/10,Livington High School,Livington,AL,0,1,1,Domestic w/ Targeted Victim,High,Outside on School Property,,1,32,Male,Black
2/5/10,Discovery Middle School,Madison,AL,1,0,1,,Middle,Inside School Building,Handgun,1,14,Male,Some Other
2/10/10,Inskip Elementary School,Knoxville,TN,0,2,2,Anger Over Grade/Suspension/Discipline,High,Inside School Building,Handgun,1,48,Male,
2/23/10,Deer Creek Middle School,Littleton,CO,0,2,2,Mental Health,Middle,Outside on School Property,Rifle,1,32,Male,White
2/26/10,Binary Elementary School,Tacoma,WA,1,0,1,Domestic w/ Targeted Victim,Elementary,Outside on School Property,,1,30,Male,White
4/28/10,Woodrow Wilson High School,Portsmouth,VA,0,0,0,Bullying,High,Inside School Building,Handgun,1,15,Male,Black
5/18/10,South Gate High School,South Gate,CA,0,1,1,,High,Outside on School Property,Handgun,1,17,Male,
8/30/10,Sullivan Central High School,Blountville,TN,1,0,1,Hostage Standoff,High,Inside School Building,Handgun,1,62,Male,White
9/8/10,Mumford High School,Detroit,MI,0,2,2,Escalation of Dispute,High,Outside on School Property,,1,17,Male,Black
9/21/10,Socastee High School,Conway,SC,0,1,1,Bullying,High,Inside School Building,Handgun,1,15,Male,White
10/1/10,Alisal High School,Salinas,CA,1,0,1,Gang-related,High,Outside on School Property,,1,,,
10/8/10,Kelly Elementary School,Carlsbad,CA,0,2,2,Indiscriminate Shooting,Elementary,Outside on School Property,Handgun,1,41,Male,White
10/23/10,Topeka West High School,Topeka,KS,1,1,2,Illegal Drug Related,High,Outside on School Property,Handgun,2,,Male,White
11/29/10,Marinette High School,Marinette,WI,1,0,1,Hostage Standoff,High,Inside School Building,Handgun,1,15,Male,White
12/6/10,Aurora Central High School,Aurora,CO,0,1,1,Gang-related,High,Outside on School Property,Handgun,1,23,Male,White
1/4/11,Crown Point School bus,Crown Point,IN,0,0,0,Intentional Property Damage,,School Bus,Other,,,,
1/5/11,Millard South High School,Omaha,NE,2,1,3,Anger Over Grade/Suspension/Discipline,High,Inside School Building,Handgun,1,17,Male,Some Other
1/18/11,Gardena High School,Los Angeles,CA,0,2,2,Accidental,High,Inside School Building,Handgun,1,17,Male,Black
2/2/11,Louisiana Schnell Elementary School,Placerville,CA,1,0,1,Escalation of Dispute,Elementary,Inside School Building,Handgun,1,44,Male,White
3/25/11,Martinsville West Middle School,Martinsville,IN,0,1,1,Escalation of Dispute,Middle,Inside School Building,Handgun,1,16,Male,White
3/30/11,Worthing High School,Houston,TX,1,5,6,Gang-related,High,Outside on School Property,Handgun,3,,Male,Black
4/13/11,Sheeler Charter High School,Apopka,FL,0,1,1,Escalation of Dispute,High,Outside on School Property,Handgun,1,17,Male,
4/19/11,Betsy Ross Elementary School,Houston,TX,0,3,3,Accidental,Elementary,Inside School Building,Handgun,1,6,Male,
5/17/11,Horizon Elementary School,Everett,WA,0,1,1,Gang-related,Elementary,Outside on School Property,Handgun,1,16,Male,
5/23/11,Highlands Intermediate School,Pearl City,HI,0,1,1,Accidental,12-Jun,Outside on School Property,Handgun,1,14,Male,Native Hawaiian or Other Pacific Islander
9/23/11,Issaquah High School,Seattle,WA,1,0,1,,High,Off School Property,Rifle,1,51,Male,
9/30/11,Garinger High School,Charlotte,NC,0,1,1,Gang-related,High,Outside on School Property,Handgun,1,,Male,
9/30/11,Wilson High School,Portland,OR,0,0,0,Gang-related,High,Outside on School Property,Combination of Different Types of Weapons,2,20,Male,White
10/24/11,Cape Fear High School,Fayetteville,NC,0,1,1,Escalation of Dispute,High,Outside on School Property,Rifle,1,15,Male,Black
12/12/11,Harwell Middle School,Edinburg,TX,0,2,2,Accidental,Middle,Outside on School Property,Rifle,1,36,Male,White
12/28/11,Northern High School,Flint,MI,0,1,1,Escalation of Dispute,High,Outside on School Property,Handgun,2,17,Male,Black
1/4/12,Cummings Middle School,Brownsville,TX,1,0,1,Officer Involved Shooting,Middle,Inside School Building,Handgun,1,,,
1/10/12,North Forest High School,Houston,TX,0,1,1,Escalation of Dispute,High,Inside School Building,Handgun,1,18,Male,Black
2/10/12,Walpole Elementary School,Walpole,NH,0,1,1,Suicide/Attempted,Elementary,Inside School Building,Shotgun,1,14,Male,White
2/22/12,Armin Jahr Elementary School,Bremerton,WA,0,1,1,Accidental,Elementary,Inside School Building,Handgun,1,10,Male,White
2/27/12,Chardon High School,Chardon,OH,3,3,6,Indiscriminate Shooting,High,Inside School Building,Handgun,1,17,Male,White
3/6/12,Episcopal School of Jacksonville,Jacksonville,FL,2,0,2,Murder/Suicide,12-Jun,Inside School Building,Rifle,1,28,Male,White
3/15/12,LeFlore High School,Mobile,AL,0,0,0,Gang-related,High,Outside on School Property,Handgun,1,16,Male,Black
4/1/12,Kirksey Middle School,Rogers,AR,0,1,1,Escalation of Dispute,Middle,Outside on School Property,Handgun,1,18,Male,White
5/25/12,West View High School,Avondale,AZ,1,0,1,Domestic w/ Targeted Victim,High,Outside on School Property,Handgun,1,38,Male,Black
5/25/12,Mary Scroggs Elementary School,Chapel Hill,NC,1,0,1,Domestic w/ Targeted Victim,Elementary,Outside on School Property,Handgun,1,51,Male,White
7/6/12,Nathaniel Greene Elementary School,Pawtucket,RI,1,0,1,Escalation of Dispute,Elementary,Outside on School Property,,1,20,Male,Black
8/16/12,Hamilton High School,Memphis,TN,0,0,0,Gang-related,High,Outside on School Property,,,,Male,
8/24/12,Banks County High School,Homer,GA,1,0,1,Suicide/Attempted,High,Inside School Building,Handgun,1,15,Male,
8/27/12,Perry Hall High School,Perry Hall,MD,0,1,1,Indiscriminate Shooting,High,Inside School Building,Shotgun,1,15,Male,White
9/7/12,Normal Community High School,Normal,IL,0,0,0,Hostage Standoff,High,Inside School Building,Handgun,1,15,Male,White
9/26/12,Stillwater Junior High School,Stillwater,OK,1,0,1,Suicide/Attempted,Junior High,Inside School Building,Handgun,1,13,Male,White
10/12/12,Fairmount Public School,Fairmont,ND,0,1,1,Suicide/Attempted,High,Inside School Building,Handgun,1,,Male,
10/19/12,Banner Academy South,Chicago,IL,1,0,1,Robbery,Other,Outside on School Property,,2,14,Male,Black
12/10/12,Spring Woods High School,Houston,TX,0,0,0,Accidental,High,Inside School Building,Handgun,1,15,Male,
12/14/12,Sandy Hook Elementary School,Newtown,CT,28,2,30,Indiscriminate Shooting,Elementary,Inside School Building,Combination of Different Types of Weapons,1,20,Male,White
1/7/13,Apostolic Revival Center Christian School,Fort Myers,FL,1,0,1,Gang-related,K-8,Outside on School Property,,1,,,
1/10/13,Taft Union High School,Taft,CA,0,2,2,Bullying,High,Inside School Building,Shotgun,1,16,Male,White
1/11/13,Osborn High School,Detroit,MI,0,1,1,Gang-related,High,Off School Property,,1,,Male,
1/31/13,Price Middle School,Atlanta,GA,0,1,1,Escalation of Dispute,Middle,Outside on School Property,Handgun,1,15,Male,
2/1/13,Martin Luther King High School,Detroit,MI,1,1,2,Self Defense,High,Outside on School Property,Handgun,1,70,Male,
2/13/13,Hillside Elementary School,San Leandro,CA,1,0,1,Escalation of Dispute,Elementary,Outside on School Property,Handgun,1,18,Male,Black
2/27/13,Grady High School,Atlanta,GA,0,1,1,Accidental,High,Outside on School Property,Handgun,1,17,Female,Black
3/21/13,Davidson Middle School,Southgate,MI,1,0,1,Suicide/Attempted,Middle,Inside School Building,Handgun,1,13,Male,White
4/16/13,Temple High School,Temple,TX,1,0,1,Suicide/Attempted,High,Outside on School Property,Handgun,1,15,Male,
4/29/13,La Salle High School,Cincinnati,OH,0,1,1,Suicide/Attempted,High,Inside School Building,Handgun,1,17,Male,
